{
  "$schema": "https://json-schema.org/draft/2020-12/schema",
  "$id": "https://daggersearch.com/schemas/ancestries.schema.json",
  "type": "array",
  "items": {
    "type": "object",
    "properties": {
      "id": {
        "$ref": "./common/id.schema.json"
      },
      "name": {
        "$ref": "./common/localized-string.schema.json"
      },
      "description": {
        "$ref": "./common/localized-string.schema.json"
      },
      "features": {
        "type": "array",
        "items": {
          "$ref": "./common/feature.schema.json"
        }
      }
    },
    "required": ["id", "name", "description", "features"],
    "additionalProperties": false
  }
}
