[
  {
    "id": "the_void_ancestry_earthkin",
    "name": { "en-US": "Earthkin" },
    "description": [
      {
        "paragraph": {
          "en-US": "Earthkin are descended from earth elementals. They are humanoids whose bodies are a combination of flesh and earth."
        }
      }
    ],
    "features": [
      {
        "name": { "en-US": "Stoneskin" },
        "description": [
          {
            "paragraph": {
              "en-US": "Gain a +1 bonus to your Armor Score and Damage Thresholds."
            }
          }
        ]
      },
      {
        "name": { "en-US": "Immoveable" },
        "description": [
          {
            "paragraph": {
              "en-US": "While your feet are touching the ground, you cannot be lifted or moved against your will."
            }
          }
        ]
      }
    ]
  },
  {
    "id": "the_void_ancestry_skykin",
    "name": { "en-US": "Skykin" },
    "description": [
      {
        "paragraph": {
          "en-US": "Skykin are descended from air elementals. They are humanoids whose bodies are a combination of flesh and air."
        }
      }
    ],
    "features": [
      {
        "name": { "en-US": "Gale Force" },
        "description": [
          {
            "paragraph": {
              "en-US": "Mark a Stress to conjure a gust of wind that carries you or an ally up to Very Far range. Additionally, you can always control the speed at which you fall."
            }
          }
        ]
      },
      {
        "name": { "en-US": "Eye of the Storm" },
        "description": [
          {
            "paragraph": {
              "en-US": "Spend 2 Hope to grant a +1 bonus to either your or an ally's Evasion until you next take Severe damage or you use Eye of the Storm again."
            }
          }
        ]
      }
    ]
  },
  {
    "id": "the_void_ancestry_tidekin",
    "name": { "en-US": "Tidekin" },
    "description": [
      {
        "paragraph": {
          "en-US": "Tidekin are descended from water elementals. They are humanoids whose bodies are a combination of flesh and water."
        }
      }
    ],
    "features": [
      {
        "name": { "en-US": "Amphibious" },
        "description": [
          {
            "paragraph": {
              "en-US": "You can breathe and move naturally underwater."
            }
          }
        ]
      },
      {
        "name": { "en-US": "Lifespring" },
        "description": [
          {
            "paragraph": {
              "en-US": "Once per rest, when you have access to a small amount of water, you can mark 2 Stress to heal a Hit Point on yourself or an ally."
            }
          }
        ]
      }
    ]
  },
  {
    "id": "the_void_ancestry_emberkin",
    "name": { "en-US": "Emberkin" },
    "description": [
      {
        "paragraph": {
          "en-US": "Emberkin are descended from fire elementals. They are humanoids whose bodies are a combination of flesh and fire."
        }
      }
    ],
    "features": [
      {
        "name": { "en-US": "Fireproof" },
        "description": [
          {
            "paragraph": {
              "en-US": "You are immune to damage from magical or mundane flame."
            }
          }
        ]
      },
      {
        "name": { "en-US": "Ignition" },
        "description": [
          {
            "paragraph": {
              "en-US": "Mark a Stress to wreathe your primary weapon in flame until the end of the scene. While ablaze, it gives off a bright light and grants a 1d6 bonus to damage rolls against targets within Melee range."
            }
          }
        ]
      }
    ]
  },
  {
    "id": "the_void_ancestry_aetheris",
    "name": { "en-US": "Aetheris" },
    "description": [
      {
        "paragraph": {
          "en-US": "Aetheris are humanoids who possess radiant auras and glowing eyes. They are the descendants of celestials from the Hallows Above."
        }
      }
    ],
    "features": [
      {
        "name": { "en-US": "Hallowed Aura" },
        "description": [
          {
            "paragraph": {
              "en-US": "Once per rest, when an ally within Close range rolls with Fear, you can make it a roll with Hope instead."
            }
          }
        ]
      },
      {
        "name": { "en-US": "Divine Countenance" },
        "description": [
          {
            "paragraph": {
              "en-US": "You have advantage on rolls to command or persuade."
            }
          }
        ]
      }
    ]
  },
  {
    "id": "the_void_ancestry_gnome",
    "name": { "en-US": "Gnome" },
    "description": [
      {
        "paragraph": {
          "en-US": "Gnomes are small humanoids most easily recognized by their dense musculature, long arms, and large facial features."
        }
      }
    ],
    "features": [
      {
        "name": { "en-US": "Nimble Fingers" },
        "description": [
          {
            "paragraph": {
              "en-US": "When you make a Finesse Roll, you can spend 2 Hope to reroll your Hope Die."
            }
          }
        ]
      },
      {
        "name": { "en-US": "True Sight" },
        "description": [
          {
            "paragraph": {
              "en-US": "You have advantage on rolls to see through illusions."
            }
          }
        ]
      }
    ]
  }
]
